{
  "$schema": "http://json-schema.org/draft-07/schema#",
  "title": "ELTS agent efficiency policy v3",
  "description": "Project settings consumed by tools/ai/sync-config.ps1. Changes to this contract require a new version and compatibility notes.",
  "type": "object",
  "additionalProperties": false,
  "required": [
    "$schema",
    "schemaVersion",
    "model",
    "model_reasoning_effort",
    "model_verbosity",
    "tool_output_token_limit",
    "agents"
  ],
  "properties": {
    "$schema": {
      "const": "../../schemas/ai/agent-policy.v3.schema.json"
    },
    "schemaVersion": {
      "const": 3
    },
    "model": {
      "const": "gpt-6-astra"
    },
    "model_reasoning_effort": {
      "description": "Portable intersection of verified Astra and documented Codex settings. Higher app-specific levels require compatibility review.",
      "enum": [
        "low",
        "medium",
        "high",
        "xhigh"
      ]
    },
    "model_verbosity": {
      "enum": [
        "low",
        "medium",
        "high"
      ]
    },
    "tool_output_token_limit": {
      "description": "Per-output retained history budget, not a task or reasoning-token cap. Bounds are project guardrails, not vendor limits.",
      "type": "integer",
      "minimum": 1000,
      "maximum": 16000
    },
    "agents": {
      "required": [
        "enabled",
        "max_concurrent_threads_per_session",
        "default_subagent_model",
        "default_subagent_reasoning_effort"
      ],
      "type": "object",
      "additionalProperties": false,
      "properties": {
        "enabled": {
          "type": "boolean"
        },
        "default_subagent_model": {
          "enum": [
            "gpt-5.3-codex-spark",
            "gpt-5.6-luna",
            "gpt-5.6-terra"
          ],
          "description": "Default worker model; select higher-capability workers explicitly according to AGENTS.md. Host availability must be checked."
        },
        "default_subagent_reasoning_effort": {
          "enum": [
            "low",
            "medium",
            "high",
            "xhigh"
          ]
        },
        "max_concurrent_threads_per_session": {
          "minimum": 1,
          "description": "Spawned agents only; seven plus the primary gives eight total. This maximum is a project guardrail.",
          "type": "integer",
          "maximum": 7
        }
      }
    }
  }
}
